{
  "schemaVersion": 1,
  "specificationBasis": "FTMS 1.0 measurement notifications; ESR11 signed fields",
  "fieldOrder": [
    "speed",
    "averageSpeed",
    "distance",
    "inclination",
    "rampAngle",
    "positiveElevation",
    "negativeElevation",
    "instantaneousPace",
    "averagePace",
    "energy",
    "energyPerHour",
    "energyPerMinute",
    "heartRate",
    "met",
    "elapsed",
    "remaining",
    "force",
    "power",
    "stepRate",
    "averageStepRate",
    "strideCount",
    "resistance",
    "averagePower",
    "floorCount",
    "stepCount",
    "strokeRate",
    "strokeCount",
    "averageStrokeRate",
    "cadence",
    "averageCadence"
  ],
  "cases": [
    {
      "id": "minimal-treadmill",
      "kind": 0,
      "bytes": [
        0,
        0,
        210,
        4
      ],
      "decoded": {
        "kind": 0,
        "flags": 0,
        "present": 1,
        "unavailable": 0,
        "values": [
          1234,
          0,
          0,
          0,
          0,
          0,
          0,
          0,
          0,
          0,
          0,
          0,
          0,
          0,
          0,
          0,
          0,
          0,
          0,
          0,
          0,
          0,
          0,
          0,
          0,
          0,
          0,
          0,
          0,
          0
        ],
        "moreData": 0,
        "backward": 0,
        "truncated": 0,
        "trailingBytes": 0,
        "reservedFlags": 0,
        "bytesRead": 4
      },
      "encode": true
    },
    {
      "id": "minimal-cross",
      "kind": 1,
      "bytes": [
        0,
        0,
        0,
        210,
        4
      ],
      "decoded": {
        "kind": 1,
        "flags": 0,
        "present": 1,
        "unavailable": 0,
        "values": [
          1234,
          0,
          0,
          0,
          0,
          0,
          0,
          0,
          0,
          0,
          0,
          0,
          0,
          0,
          0,
          0,
          0,
          0,
          0,
          0,
          0,
          0,
          0,
          0,
          0,
          0,
          0,
          0,
          0,
          0
        ],
        "moreData": 0,
        "backward": 0,
        "truncated": 0,
        "trailingBytes": 0,
        "reservedFlags": 0,
        "bytesRead": 5
      },
      "encode": true
    },
    {
      "id": "minimal-step",
      "kind": 2,
      "bytes": [
        0,
        0,
        12,
        0,
        34,
        0
      ],
      "decoded": {
        "kind": 2,
        "flags": 0,
        "present": 25165824,
        "unavailable": 0,
        "values": [
          0,
          0,
          0,
          0,
          0,
          0,
          0,
          0,
          0,
          0,
          0,
          0,
          0,
          0,
          0,
          0,
          0,
          0,
          0,
          0,
          0,
          0,
          0,
          12,
          34,
          0,
          0,
          0,
          0,
          0
        ],
        "moreData": 0,
        "backward": 0,
        "truncated": 0,
        "trailingBytes": 0,
        "reservedFlags": 0,
        "bytesRead": 6
      },
      "encode": true
    },
    {
      "id": "minimal-stair",
      "kind": 3,
      "bytes": [
        0,
        0,
        12,
        0
      ],
      "decoded": {
        "kind": 3,
        "flags": 0,
        "present": 8388608,
        "unavailable": 0,
        "values": [
          0,
          0,
          0,
          0,
          0,
          0,
          0,
          0,
          0,
          0,
          0,
          0,
          0,
          0,
          0,
          0,
          0,
          0,
          0,
          0,
          0,
          0,
          0,
          12,
          0,
          0,
          0,
          0,
          0,
          0
        ],
        "moreData": 0,
        "backward": 0,
        "truncated": 0,
        "trailingBytes": 0,
        "reservedFlags": 0,
        "bytesRead": 4
      },
      "encode": true
    },
    {
      "id": "minimal-rower",
      "kind": 4,
      "bytes": [
        0,
        0,
        48,
        200,
        0
      ],
      "decoded": {
        "kind": 4,
        "flags": 0,
        "present": 100663296,
        "unavailable": 0,
        "values": [
          0,
          0,
          0,
          0,
          0,
          0,
          0,
          0,
          0,
          0,
          0,
          0,
          0,
          0,
          0,
          0,
          0,
          0,
          0,
          0,
          0,
          0,
          0,
          0,
          0,
          48,
          200,
          0,
          0,
          0
        ],
        "moreData": 0,
        "backward": 0,
        "truncated": 0,
        "trailingBytes": 0,
        "reservedFlags": 0,
        "bytesRead": 5
      },
      "encode": true
    },
    {
      "id": "minimal-bike",
      "kind": 5,
      "bytes": [
        0,
        0,
        210,
        4
      ],
      "decoded": {
        "kind": 5,
        "flags": 0,
        "present": 1,
        "unavailable": 0,
        "values": [
          1234,
          0,
          0,
          0,
          0,
          0,
          0,
          0,
          0,
          0,
          0,
          0,
          0,
          0,
          0,
          0,
          0,
          0,
          0,
          0,
          0,
          0,
          0,
          0,
          0,
          0,
          0,
          0,
          0,
          0
        ],
        "moreData": 0,
        "backward": 0,
        "truncated": 0,
        "trailingBytes": 0,
        "reservedFlags": 0,
        "bytesRead": 4
      },
      "encode": true
    },
    {
      "id": "more-data-treadmill",
      "kind": 0,
      "bytes": [
        1,
        0
      ],
      "decoded": {
        "kind": 0,
        "flags": 1,
        "present": 0,
        "unavailable": 0,
        "values": [
          0,
          0,
          0,
          0,
          0,
          0,
          0,
          0,
          0,
          0,
          0,
          0,
          0,
          0,
          0,
          0,
          0,
          0,
          0,
          0,
          0,
          0,
          0,
          0,
          0,
          0,
          0,
          0,
          0,
          0
        ],
        "moreData": 1,
        "backward": 0,
        "truncated": 0,
        "trailingBytes": 0,
        "reservedFlags": 0,
        "bytesRead": 2
      },
      "encode": true
    },
    {
      "id": "more-data-cross",
      "kind": 1,
      "bytes": [
        1,
        0,
        0
      ],
      "decoded": {
        "kind": 1,
        "flags": 1,
        "present": 0,
        "unavailable": 0,
        "values": [
          0,
          0,
          0,
          0,
          0,
          0,
          0,
          0,
          0,
          0,
          0,
          0,
          0,
          0,
          0,
          0,
          0,
          0,
          0,
          0,
          0,
          0,
          0,
          0,
          0,
          0,
          0,
          0,
          0,
          0
        ],
        "moreData": 1,
        "backward": 0,
        "truncated": 0,
        "trailingBytes": 0,
        "reservedFlags": 0,
        "bytesRead": 3
      },
      "encode": true
    },
    {
      "id": "more-data-step",
      "kind": 2,
      "bytes": [
        1,
        0
      ],
      "decoded": {
        "kind": 2,
        "flags": 1,
        "present": 0,
        "unavailable": 0,
        "values": [
          0,
          0,
          0,
          0,
          0,
          0,
          0,
          0,
          0,
          0,
          0,
          0,
          0,
          0,
          0,
          0,
          0,
          0,
          0,
          0,
          0,
          0,
          0,
          0,
          0,
          0,
          0,
          0,
          0,
          0
        ],
        "moreData": 1,
        "backward": 0,
        "truncated": 0,
        "trailingBytes": 0,
        "reservedFlags": 0,
        "bytesRead": 2
      },
      "encode": true
    },
    {
      "id": "more-data-stair",
      "kind": 3,
      "bytes": [
        1,
        0
      ],
      "decoded": {
        "kind": 3,
        "flags": 1,
        "present": 0,
        "unavailable": 0,
        "values": [
          0,
          0,
          0,
          0,
          0,
          0,
          0,
          0,
          0,
          0,
          0,
          0,
          0,
          0,
          0,
          0,
          0,
          0,
          0,
          0,
          0,
          0,
          0,
          0,
          0,
          0,
          0,
          0,
          0,
          0
        ],
        "moreData": 1,
        "backward": 0,
        "truncated": 0,
        "trailingBytes": 0,
        "reservedFlags": 0,
        "bytesRead": 2
      },
      "encode": true
    },
    {
      "id": "more-data-rower",
      "kind": 4,
      "bytes": [
        1,
        0
      ],
      "decoded": {
        "kind": 4,
        "flags": 1,
        "present": 0,
        "unavailable": 0,
        "values": [
          0,
          0,
          0,
          0,
          0,
          0,
          0,
          0,
          0,
          0,
          0,
          0,
          0,
          0,
          0,
          0,
          0,
          0,
          0,
          0,
          0,
          0,
          0,
          0,
          0,
          0,
          0,
          0,
          0,
          0
        ],
        "moreData": 1,
        "backward": 0,
        "truncated": 0,
        "trailingBytes": 0,
        "reservedFlags": 0,
        "bytesRead": 2
      },
      "encode": true
    },
    {
      "id": "more-data-bike",
      "kind": 5,
      "bytes": [
        1,
        0
      ],
      "decoded": {